Channel,Title,Views,Likes,Comments,Engagement Rate (%),Published Date,URL
Umar Tazkeer ,Sunday Charcha ,186,23,4,14.52,2025-08-24,https://www.youtube.com/watch?v=XS6A37gH-tw
DMarketing Wall,Best WordPress Theme for Marketing Agency | 10x ज्यादा Clients आने लगे!,91,13,0,14.29,2025-08-23,https://www.youtube.com/watch?v=DSDmEnbqAyk
Nexile Digital,Finding the right digital agency can be a game-changer for your business!  - Nexile Digital,32,0,0,0.0,2025-08-24,https://www.youtube.com/watch?v=yy9jCDgck68
Zain Ali - The Digital Doctor,LEC 12 | Portfolio Building & Digital Marketing Agency Roadmap - NDU SMM Course 2025,1278,128,0,10.02,2025-08-23,https://www.youtube.com/watch?v=BCOqdLL0ZGE
Nitashh Healthcare Marketing Solutions,Digital Marketing Services in Pimpri Chinchwad Maharashtra Digital Marketing Agency in Pimpri Chinch,0,0,0,0,2025-08-24,https://www.youtube.com/watch?v=5CPBxt5iztU
FirstPageRanks Digital,LinkedIn Marketing Services in Jaipur | Digital Marketing Firm in Jaipur | FirstPageRanks,4,0,0,0.0,2025-08-23,https://www.youtube.com/watch?v=-zrtncOOXVk
CTS,Digital Marketing Agency - Digital Mind Fusion,74,0,0,0.0,2025-08-23,https://www.youtube.com/watch?v=uhgACzzCC78
ThinkNEXT Technologies Private Limited,Advanced Digital Marketing Course with AI | ThinkNEXT Chandigarh,8,1,0,12.5,2025-08-23,https://www.youtube.com/watch?v=sb1tGU9OFOQ
Aditya Singh  - I Run Ads,"How To Get Clients, Scale Agency and Build Stable Freelancing Business | Ep.1 | Aditya Singh",426,0,6,1.41,2025-08-23,https://www.youtube.com/watch?v=6EiH0z7qXyM
FirstPageRanks Digital,"Local Digital Marketing Company in Delhi NCR, India | FirstPageRanks",3,0,0,0.0,2025-08-23,https://www.youtube.com/watch?v=YhgJmqfIx-w
FirstPageRanks Digital,LinkedIn Marketing Services in Faridabad | Digital Marketing Firm in Faridabad | FirstPageRanks,1,0,0,0.0,2025-08-23,https://www.youtube.com/watch?v=bh8YLK6pNoU
HSQ DIGITAL HUB,INTRODUCTION TO DIGITAL MARKETING -  (CLASS 06) HSQ DIGITAL HUB,26,0,1,3.85,2025-08-23,https://www.youtube.com/watch?v=H1zwtoCsjnY
Extreem Boost,How to Boost Your Business with Digital Marketing | Extreem Boost Agency,0,0,0,0,2025-08-23,https://www.youtube.com/watch?v=_QQf4191iME
Marketing Fundas,Cafe Marketing Full Course in Hindi | How to Market Your Cafe Complete Marketing Strategies | #cafe,234,25,6,13.25,2025-08-24,https://www.youtube.com/watch?v=3AFQTqlwB2M
Marketing Safalta,Digital Marketing Strategy for Tour & Travel Company | Digital Marketing Tips for Travel Agencies,47,3,1,8.51,2025-08-23,https://www.youtube.com/watch?v=sJFN8mb6AKs
Tara Lilly & Co.,Does Your Agency Control Your Digital Assets? Here's What You Need to Know,19,0,0,0.0,2025-08-23,https://www.youtube.com/watch?v=Ds8x58AUfS4
IQnection Digital Marketing Agency,Online listings for contractors,54,0,0,0.0,2025-08-23,https://www.youtube.com/watch?v=c2wibETUTqg
FirstPageRanks Digital,LinkedIn Marketing Services in Rishikesh | Digital Marketing Firm in Rishikesh | FirstPageRanks,3,0,0,0.0,2025-08-23,https://www.youtube.com/watch?v=rFyFUlBCCP0
India's Business Legends,AdBullet's Gopal Verma: From Balcony Startup to Google & Meta Partnered Agency | 20M+ Leads,107,17,1,16.82,2025-08-23,https://www.youtube.com/watch?v=QbP6YDJG09k
Brand Digital Solutions,Get Started,224,1,0,0.45,2025-08-23,https://www.youtube.com/watch?v=byX2E759Igg
"Digital Marketing Experts in Kota , Kotapride","Build Your Online Store | E-Commerce Website Development - Start at ₹35,000 | Kotapride Agency",43,1,0,2.33,2025-08-23,https://www.youtube.com/watch?v=WZM89fou7pk
Meet Observer,Day 86/90 of Growing our Marketing Agency. #marketingservices  #socialmediaagency  #digital,971,5,0,0.51,2025-08-23,https://www.youtube.com/watch?v=xPpWeWPUuZM
FirstPageRanks Digital,LinkedIn Marketing Services in Mumbai | Digital Marketing Firm in Mumbai | FirstPageRanks,1,0,0,0.0,2025-08-23,https://www.youtube.com/watch?v=rYdOrxnNSgc
FirstPageRanks Digital,LinkedIn Marketing Services in Zirakpur | Digital Marketing Firm in Zirakpur | FirstPageRanks,4,0,0,0.0,2025-08-23,https://www.youtube.com/watch?v=OZQ_7ghrthU
FirstPageRanks Digital,LinkedIn Marketing Services in Panchkula | Digital Marketing Firm in Panchkula | FirstPageRanks,1,0,0,0.0,2025-08-23,https://www.youtube.com/watch?v=JcU_iPEImcU
FirstPageRanks Digital,LinkedIn Marketing Services in Ghaziabad | Digital Marketing Firm in Ghaziabad | FirstPageRanks,1,0,0,0.0,2025-08-23,https://www.youtube.com/watch?v=27C2shLIH9k
FirstPageRanks Digital,LinkedIn Marketing Services in Gurgaon | Digital Marketing Firm in Gurgaon | FirstPageRanks,1,0,0,0.0,2025-08-23,https://www.youtube.com/watch?v=F1MbnY9Vh50
FirstPageRanks Digital,LinkedIn Marketing Services in Udaipur | Digital Marketing Firm in Udaipur | FirstPageRanks,1,0,0,0.0,2025-08-23,https://www.youtube.com/watch?v=8L86YElPWrQ
FirstPageRanks Digital,LinkedIn Marketing Services in Kanpur | Digital Marketing Firm in Kanpur | FirstPageRanks,1,0,0,0.0,2025-08-23,https://www.youtube.com/watch?v=ngI9goGQ1t4
FirstPageRanks Digital,LinkedIn Marketing Services in Chandigarh | Digital Marketing Firm in Chandigarh | FirstPageRanks,1,0,0,0.0,2025-08-23,https://www.youtube.com/watch?v=_zqRIfBeztQ
FirstPageRanks Digital,LinkedIn Marketing Services in Lucknow | Digital Marketing Firm in Lucknow | FirstPageRanks,1,0,0,0.0,2025-08-23,https://www.youtube.com/watch?v=WadFMcwiiy0
FirstPageRanks Digital,LinkedIn Marketing Services in Mohali | Digital Marketing Firm in Mohali | FirstPageRanks,2,0,0,0.0,2025-08-23,https://www.youtube.com/watch?v=dpiZ7Y5tV-w
FirstPageRanks Digital,LinkedIn Marketing Services in Bangalore | Digital Marketing Firm in Bangalore | FirstPageRanks,1,0,0,0.0,2025-08-23,https://www.youtube.com/watch?v=xHp7KTS0-u4
FirstPageRanks Digital,LinkedIn Marketing Services in Kolkata | Digital Marketing Firm in Kolkata | FirstPageRanks,1,0,0,0.0,2025-08-23,https://www.youtube.com/watch?v=TBy_to5SXGI
Beyond Agency Profits,The Lazy Genius Sales Trick,563,1,0,0.18,2025-08-23,https://www.youtube.com/watch?v=T1XvOUAQEiA
FirstPageRanks Digital,LinkedIn Marketing Services in Dehradun | Digital Marketing Firm in Dehradun | FirstPageRanks,1,0,0,0.0,2025-08-23,https://www.youtube.com/watch?v=zR7eCzhKURw
FirstPageRanks Digital,LinkedIn Marketing Services in Chennai | Digital Marketing Firm in Chennai | FirstPageRanks,1,0,0,0.0,2025-08-23,https://www.youtube.com/watch?v=JBYyZTunZVI
FirstPageRanks Digital,LinkedIn Marketing Services in Delhi NCR | Digital Marketing Firm in Delhi NCR | FirstPageRanks,2,0,0,0.0,2025-08-23,https://www.youtube.com/watch?v=Dm3paxmt98Y
FirstPageRanks Digital,LinkedIn Marketing Services in Hyderabad | Digital Marketing Firm in Hyderabad | FirstPageRanks,1,0,0,0.0,2025-08-23,https://www.youtube.com/watch?v=JfjBvXUt16M
FirstPageRanks Digital,LinkedIn Marketing Services in Ahmedabad | Digital Marketing Firm in Ahmedabad | FirstPageRanks,4,0,0,0.0,2025-08-23,https://www.youtube.com/watch?v=pNZgZqzD0OA
Sorav Jain,Best Masters in Digital Marketing | #1 Ranked Master's Program for Future Marketers,128,2,0,1.56,2025-08-23,https://www.youtube.com/watch?v=WKQ5vVuBNUc
CroudiWebs,Real Estate Agency Project Growth! Website + App + 5-Day Marketing Campaign @ ₹499 | CroudiWebs,330,0,0,0.0,2025-08-24,https://www.youtube.com/watch?v=9IUayUAWasA
IDAMARIS & Co.,Our Services,0,0,0,0,2025-08-23,https://www.youtube.com/watch?v=t7PNxZXNZwM
Franky Moves,Grow Your Agency: Proven System for $100K+ Monthly #shorts,60,0,0,0.0,2025-08-23,https://www.youtube.com/watch?v=BtK3nY7PFic
JupiterWave Technologies,Best Digital Marketing Agency in India | ROI-Driven PPC & Lead Generation - JupiterWave,24,0,0,0.0,2025-08-23,https://www.youtube.com/watch?v=VVFM8bbhThY
Isaac Ward,From Poverty to Power: Aria Chen's Inspiring Digital Marketing Journey #Success #Inspiration #Hustle,61,1,0,1.64,2025-08-23,https://www.youtube.com/watch?v=1GWIL6RQXVk
COSMarketing Agency,How Video Content Can Get You More Customers Fast!,7,0,0,0.0,2025-08-23,https://www.youtube.com/watch?v=IRop1zu-K9I
Umar Tazkeer ,Send Qualified/Won Stages to Meta via GHL CAPI | GoHigh Level Course #10,597,35,3,6.37,2025-08-23,https://www.youtube.com/watch?v=1iNNw7KHQJs
Market Edge Pro,Market Edge Pro | #DigitalMarketingAgency That Helps You Grow Fast  #MarketEdgePro,26,3,0,11.54,2025-08-23,https://www.youtube.com/watch?v=2vMGJ3uRHlg
Tech Katori,Online services |Smarter Content Strategy with the Best Digital Marketing Agency Haldwani |,5,0,0,0.0,2025-08-23,https://www.youtube.com/watch?v=wNqkeW_-kUU
